{
  "clientId": 5012,
  "user": {
    "id": 3001,
    "type": "STAFF"
  },
  "deliveryCharge": 25,
  "deliveryType": "Delivery",
  "requestedDeliveryDate": "2026-06-10",
  "currency": "USD",
  "addresses": {},
  "products": [
    {
      "productId": 90210,
      "sku": "WINE-CAB-750",
      "name": "Cabernet Sauvignon 750ml",
      "quantity": 12,
      "price": 18.5
    }
  ],
  "presetCreationDate": "2026-06-02T14:30:00Z"
}